Product Name,Category/Content Type,Picture,Source Language,German (Germany),Spanish (Spain,French (France),Italian (Italy),,,,,,,,
"pexar starlight 15.6"" digital picture frame",A+,,"Your Story, Now Glowing",Ihre Geschichte in neuem Glanz,"Tu historia, ahora reluciente","Votre histoire, mise en lumière","La tua storia, ora risplende",,,,,,,,
,,,"15.6"" pexar starlight digital picture frame","15,6"" Pexar Starlight digitaler Bilderrahmen","Marco fotográfico digital de 15,6"" Pexar Starlight","Cadre photo numérique pexar Starlight 39,6 cm","Cornice digitale Pexar Starlight da 15,6 pollici",,,,,,,,
,,,2025 MUSE Design Awards Gold Winner,2025 MUSE Design Awards: Gold-Auszeichnung,Ganador del oro en los premios MUSE Design Awards 2025,Lauréat Gold des MUSE Design Awards 2025,Vincitrice del MUSE Design Gold Awards 2025,,,,,,,,
,,,Yanko Design Editors Choice,Yanko Design: Editors Choice,Elección del editor de Yanko Design,Choix des rédacteurs de Yanko Design,La scelta dell'editore Yanko Design,,,,,,,,
,,,World's First Wall-Light Frame,Der erste beleuchtete Wandbilderrahmen,El primer marco de pared con luz del mundo,Le premier cadre mural lumineux au monde,La prima cornice da parete luminosa al mondo,,,,,,,,
,,,"15.6"" Largest Color-Calibrated Touchscreen","15,6"" – der größte farbkalibrierte Touchscreen","Gran pantalla táctil de 15,6"" con calibración de color","Écran tactile de 39,6 cm, le plus grand avec des couleurs précises","Il più grande touchscreen da 15,6 pollici con calibrazione del colore",,,,,,,,
,,,Gallery Lighting,Galeriebeleuchtung,Iluminación de galería,Éclairage de type galerie,Illuminazione da galleria,,,,,,,,
,,,Others No Anti-glare Pexar Anti-glare,Andere Nicht entspiegelt Pexar Entspiegelt,Otros Sin antirreflejos Antirreflejos de Pexar,Autres Sans anti-reflets pexar Anti-reflets,"Gli altri non hanno l'antiriflesso, Pexar sì",,,,,,,,
,,,Multiple Ways to Share,Viele Möglichkeiten zum Teilen,Varias formas de compartir,Plusieurs façons de partager des médias,Diversi modi di condividere,,,,,,,,
,,,Shares from Anywhere,Teilen von überall aus,Comparte desde cualquier lugar,Partage depuis n'importe où,Da qualsiasi luogo,,,,,,,,
,,,"64GB Local Storage, Holding 80,000+ Photos",64 GB lokaler Speicher für über 80.000 Fotos,64 GB de almacenamiento local con capacidad para más de 80 000 fotos,Stockage local de 64 Go Jusqu'à 80 000 photos,"64 GB di memoria interna, può contenere oltre 80.000 foto",,,,,,,,
,,,"Smart Features, ","Smart-Funktionen,","Funciones inteligentes,","Fonctions intelligentes,","Funzioni intelligenti,",,,,,,,,
,,,"Offline mode, ","Offline-Modus,","Modo sin conexión,","Mode hors ligne,","Modalità offline,",,,,,,,,
,,,"Albums, ","Alben,","Álbumes,","Albums,","Album,",,,,,,,,
,,,"Reactions,","Reaktionen,","Reacciones,","Réactions,","Reazioni,",,,,,,,,
,,,"Captions, ","Titel,","Subtítulos,","Légendes,","Didascalie,",,,,,,,,
,,,"Clock&Weather,","Uhr und Wetter,","Hora y el tiempo,","Horloge et météo,","Orologio e meteo,",,,,,,,,
,,,Sleep Mode  ,Schlafmodus,Modo de suspensión,Mode veille,Modalità riposo,,,,,,,,
,,,Recommended by 200+ Gift Guides,Von über 200 Geschenkeratgebern empfohlen,Recomendado por más de 200 guías de regalos,Recommandé par plus de 200 guides cadeaux,Consigliata da oltre 200 guide per idee regalo,,,,,,,,
,,,Yanko Design Editors Choice,Yanko Design: Editors Choice,Elección del editor de Yanko Design,Choix des rédacteurs de Yanko Design,La scelta dell'editore Yanko Design,,,,,,,,
,,,2025 MUSE Design Awards GOLD WINNER,2025 MUSE Design Awards: GOLD-AUSZEICHNUNG,Ganador del ORO en los premios MUSE Design Awards 2025,LAURéAT GOLD des MUSE Design Awards 2025,VINCITRICE del MUSE Design GOLD Awards 2025,,,,,,,,
,,,Gallery Lighting,Galeriebeleuchtung,Iluminación de galería,Éclairage de type galerie,Illuminazione da galleria,,,,,,,,
,,,Bring Starlight into Your Space,Starlight für Ihre Räume,Lleva la luz de las estrellas a tu espacio,Transformez votre espace avec Starlight,Illumina i tuoi spazi con Starlight,,,,,,,,
,,,Nighttime,Nacht,De noche,De nuit,Modalità notturna,,,,,,,,
,,,Daytime,Tag,De día,De jour,Modalità diurna,,,,,,,,
,,,Take A Closer Look,Details,Echa un vistazo más de cerca,Appréciez chaque détail,Dai un'occhiata più da vicino,,,,,,,,
,,,Wood Grain Finish,Holzmaserung,Acabado de grano de madera,Finition bois,Finitura effetto legno,,,,,,,,
,,,Canvas-Like Matting,Leinwand-Matteffekt,Mate como un lienzo,Encadrement effet toile,Cornice interna effetto tela,,,,,,,,
,,,Touch Screen,Touchscreen,Pantalla táctil,Écran tactile,Touch Screen,,,,,,,,
,,,Anti-Glare Screen,Entspiegeltes Display,Pantalla antirreflejos,Écran anti-reflets,Schermo antiriflesso,,,,,,,,
,,,Wall Mount,Wandbefestigung,Montaje en pared,Montage mural,Montaggio a parete,,,,,,,,
,,,SD Card Slot,SD-Kartensteckplatz,Ranura de tarjeta SD,Emplacement pour carte SD,Fessura per scheda SD,,,,,,,,
,,,USB Port,USB-Anschluss,Puerto USB,Port USB,Porta USB,,,,,,,,
,,,Metal Stand,Metallständer,Soporte de metal,Support métallique,Supporto metallico,,,,,,,,
,,,Power Port (No built-in battery),Stromanschluss (kein integrierter Akku),Puerto de alimentación (sin batería integrada),Port d'alimentation (aucune batterie intégrée),Porta di alimentazione (senza batteria integrata),,,,,,,,
,,,Built-in Speaker,Integrierter Lautsprecher,Altavoz incorporado,Haut-parleur intégré,Altoparlante incorporato,,,,,,,,
,,,"*USB A only for USB Flash Drive, USB C only for USB C Data Cable","* USB-A nur für USB-Flash-Laufwerke, USB-C nur für USB-C-Datenkabel","* USB-A solo para unidad flash USB, USB-C solo para cables de datos USB-C","*USB A uniquement pour clé USB, USB C uniquement pour câble de données USB C","*USB-A solo per unità flash USB, USB-C solo per cavo dati USB-C",,,,,,,,
,,,In the Box,Lieferumfang,Contenido de la caja,Contenu de la boîte,Nella confezione,,,,,,,,
,,,Quick Start Guide ,Kurzanleitung,Guía de inicio rápido,Guide de démarrage rapide,Guida rapida,,,,,,,,
,,,Frame Stand ,Rahmenständer,Soporte del marco,Support pour cadre,Supporto per cornice,,,,,,,,
,,,Power Adapter ,Netzteil,Adaptador de alimentación,Adaptateur secteur,Adattatore di alimentazione,,,,,,,,
,,,Interchangeable Plugs (Varies by region) ,Austauschbare Stecker (abhängig von der Region),Conectores intercambiables (varía por región),Prises interchangeables (varient selon la région),Prese intercambiabili (variano in base alla regione),,,,,,,,
,,,Wall-Mount Kit ,Wandbefestigungs-Kit,Kit de montaje en pared,Kit de montage mural,Kit per il montaggio a parete,,,,,,,,
,,,Anti-glare,Entspiegelt,Antirreflejos,Anti-reflets,Antiriflesso,,,,,,,,
,,,Enjoy Clarity from Every Angle,Klare Sicht aus jedem Winkel,Disfruta de claridad desde cualquier ángulo,"Une clarté parfaite, quel que soit l’angle",Ammira con la massima chiarezza da ogni angolazione,,,,,,,,
,,,"Display Anytime, Even without WiFi ","Durchgehende Anzeige, selbst ohne WLAN","Funciona en cualquier momento, incluso sin Wi-Fi","Affichage continu, même sans Wi-Fi","Osservala in ogni momento, anche senza Wi-Fi",,,,,,,,
,,,Seamlessly Transition from Tabletop to Wall Masterpiece,Als Tischaufsteller oder Wandkunst – nahtloser übergang,Transición perfecta de pieza de mesa a obra maestra de pared,Passez en toute simplicité d'un cadre posé à une installation murale,Facilmente convertibile da cornice di scrivania a capolavoro da appendere,,,,,,,,
,,,Place it anywhere—Dual Orientation,Überall platzierbar – Hoch- oder Querformat,Colócalo donde quieras: orientación doble,Installez-le où vous voulez : en mode portrait ou paysage,Posizionala ovunque: orientamento doppio,,,,,,,,
,,,Easy to Hang—Wallmount Kit Included,Leicht aufzuhängen – Wandbefestigungs-Kit inklusive,Fácil de colgar: incluye un kit de montaje en pared,Facile à suspendre avec le kit de montage mural inclus,Facile da appendere: kit di montaggio a parete incluso,,,,,,,,
,,,"Share Moments Anytime, Anywhere",Momente jederzeit und überall teilen,Comparte tus momentos en cualquier momento y lugar,"Partagez vos souvenirs à tout moment, où que vous soyez","Condividi i tuoi ricordi in qualsiasi momento, ovunque",,,,,,,,
,,,"One minute setup, Photos & videos from phone to frame","Einrichtung in einer Minute, Fotos und Videos von Smartphone auf Rahmen","Montaje en un minuto, envía tus fotos y vídeos del teléfono al marco",Installation en une minute : transférez photos et vidéos de votre téléphone vers le cadre,Foto e video dal telefono alla cornice in un minuto,,,,,,,,
,,,"More ways to share, SD card or USB drive","Verschiedene übertragungsmöglichkeiten, SD-Karte oder USB-Laufwerk",Más formas de compartir: tarjeta SD o unidad USB,Autres moyens de partage : carte SD ou lecteur USB,"Altri modi per condividere, schede SD o unità USB",,,,,,,,
,,,Send photos to multiple frames simultaneously,Übertragung von Fotos auf mehrere Rahmen gleichzeitig,Envía fotos a varios marcos a la vez,Envoyez des photos à plusieurs cadres simultanément,Invia le foto a più cornisci contemporaneamente,,,,,,,,
,,,"Los Angeles, Seattle, New York","Los Angeles, Seattle, New York","Los ángeles, Seattle, Nueva York","Los Angeles, Seattle, New York","Los Angeles, Seattle, New York",,,,,,,,
,,,Invite friends & family to share and react,Laden Sie Freunde und Familie zum Teilen und Reagieren ein,Invita a tus amigos y familiares a compartir y reaccionar,Invitez vos proches à partager des médias et à réagir,Invita amici e parenti a condividere e interagire,,,,,,,,
,,,Surprise Loved Ones with Greeting Mode,Überraschen Sie mit dem Grußmodus,Sorprende a tus seres queridos con el modo de bienvenida,Surprenez vos proches avec le mode message d'accueil,Sorprendi i tuoi cari con la modalità di messaggio di benvenuto,,,,,,,,
,,,Gift that Glows in Life Milestones,Lebensmeilensteine einmalig in Szene gesetzt,Regalo que destaca los grandes momentos de la vida,Un cadeau qui illumine les grands moments de votre vie,Un regalo per celebrare i traguardi di una vita,,,,,,,,
,,,Artwall Homedecor,Wandkunst als Dekoration,Decoración de interior con obras de arte,Décoration murale artistique,Decorazione da parete,,,,,,,,
,,,Mother's Day,Muttertag,Día de la Madre,Fête des mères,Festa della mamma,,,,,,,,
,,,Birthday,Geburtstag,Cumpleaños,Anniversaire,Compleanno,,,,,,,,
,,,Wedding Anniversary,Hochzeitstag,Aniversario de boda,Anniversaire de mariage,Anniversario di matrimonio,,,,,,,,
,,,"Private, Secure, Hold 80,000 Photos",Private und sichere Speicherung von 80.000 Fotos,"Privado, seguro, almacena 80 000 fotos","Privé, sécurisé, peut contenir jusqu'à 80 000 photos","Privata, sicura, può contenere 80.000 foto",,,,,,,,
,,,Local Storage 64GB ,64 GB lokaler Speicher,Almacenamiento local de 64 GB,Stockage local de 64 Go,memoria interna da 64 GB,,,,,,,,
,,,"Hold 80,000 600KB Photos",Für 80.000 Fotos mit je 600 KB,Almacena 80 000 fotos de 600 KB,Capacité : 80 000 photos de 600 Ko chacune,Può contenere 80.000 foto da 600 KB,,,,,,,,
,,,Expand Storage,Speicher erweitern,Almacenamiento ampliable,Possibilité d'étendre le stockage,Espandi la memoria,,,,,,,,
,,,SD Card,SD-Karte,Tarjeta SD,Carte SD,Scheda SD,,,,,,,,
,,,USB Drive,USB-Laufwerk,Unidad USB,Lecteur USB,Unità USB,,,,,,,,
,,,100% Privacy Protection,100 % Schutz der Privatsphäre,Protección total de la privacidad,Protection totale de la vie privée,Protezione della privacy al 100%,,,,,,,,
,,,"GDPR Compliant, CCPA Compliant, PSTI Compliant","DSGVO-konform, CCPA-konform, PSTI-konform","Cumple el GDPR, la CCPA y la PSTI","Conforme au RGPD, à la CCPA et à la PSTI","Conformità al GDPR, al CCPA e al PSTI",,,,,,,,
,,,"*Expandable storage requires an SD card or a USB flash drive, sold separately.","* Speichererweiterung erfordert SD-Karte oder USB Flash-Laufwerk, separat erhältlich.","* El almacenamiento ampliable requiere una tarjeta SD o una unidad flash USB, que se venden por separado.","*L'extension du stockage nécessite une carte SD ou une clé USB, vendue séparément.","*La memoria espandibile richiede una scheda SD o un'unità flash USB, venduta separatamente.",,,,,,,,
,,,Easily Organize and Display Albums ,Alben einfach organisieren und anzeigen,Organiza y expón álbumes fácilmente,Organisez et affichez facilement vos albums,Consente di organizzare e visualizzare facilmente gli album,,,,,,,,
,,,Select album to play,Album zum Abspielen auswählen,Selecciona el álbum que quieras reproducir,Sélectionner l'album à lire,Selezionare l'album da riprodurre,,,,,,,,
,,,with my dog,mit meinem Hund,con mi perro,Avec mon chien,con il mio cane,,,,,,,,
,,,Oh my baby,Oh mein Baby,Mi bebé,Mon bébé,il mio bambino,,,,,,,,
,,,with him,mit ihm,Con él,Avec lui,con lui,,,,,,,,
,,,my holiday,mein Urlaub,Mis vacaciones,Mes vacances,la mia vacanza,,,,,,,,
,,,my weekend,mein Wochenende,Mi finde,Mon week-end,il mio fine settimana,,,,,,,,
,,,Playing in slideshow,Als Diashow abspielen,Reproducción de diapositivas,Lecture dans le diaporama,Riproduzione in modalità presentazione,,,,,,,,
,,,Smart and Useful Features,Praktische Funktionen,Prácticas funciones inteligentes,Fonctionnalités intelligentes et utiles,Funzioni intelligenti e utili,,,,,,,,
,,,Reactions,Reaktionen,Reacciones,Réactions,Reazioni,,,,,,,,
,,,Captions,Titel,Subtítulos,Légendes,Didascalie,,,,,,,,
,,,Sleep Schedules,Schlaf-Timer,Programas de suspensión,Programmation du mode veille,Programmi di sospensione,,,,,,,,
,,,Clock and Weather,Uhr und Wetter,Hora y el tiempo,Horloge et météo,Orologio e meteo,,,,,,,,
,副图,,World's First Wall-Light Frame,Der erste beleuchtete Wandbilderrahmen,El primer marco de pared con luz del mundo,Le premier cadre mural lumineux au monde,La prima cornice da parete luminosa al mondo,,,,,,,,
,,,Gallery Lighting,Galeriebeleuchtung,Iluminación de galería,éclairage de type galerie,Illuminazione da galleria,,,,,,,,
,,,Shares from Anywhere,Teilen von überall aus,Comparte desde cualquier lugar,Partage depuis n'importe où,Da qualsiasi luogo,,,,,,,,
,,,"Photos, Videos, Greeting Cards","Fotos, Videos, Grußkarten","Fotos, vídeos, tarjetas de felicitación","Photos, vidéos, messages d'accueil","Foto, video, biglietti di auguri",,,,,,,,
,,,64GB Private and Secure Storage,64 GB privater und sicherer Speicher,64 GB de almacenamiento privado y seguro,64 Go Stockage privé et sécurisé,64 GB di memoria privata e sicura,,,,,,,,
,,,Largest Anti-Glare Touchscreen,Größter entspiegelter Touchscreen,Gran pantalla táctil antirreflectante,Plus grand écran tactile anti-reflets,Il più grande touch screen antiriflesso,,,,,,,,
,,,Benefit from 29 Years of Industry Experience,Das Ergebnis von 29 Jahren Branchenerfahrung,Benefíciate de 29 años de experiencia en el sector,Bénéficiez de 29 ans d'expérience dans le secteur,Affidati a 29 anni di esperienza nel settore,,,,,,,,
,,,Anti-Glare and Vibrant Display,"Lebendiges, entspiegeltes Display",Pantalla antirreflectante y vibrante,Écran anti-reflets et affichage éclatant,Display antiriflesso e ricco di colori,,,,,,,,
,,,Pexar Anti-glare Others No Anti-glare,Pexar Entspiegelt Andere Nicht entspiegelt,Antirreflejos Pexar Otros Sin antirreflejos,pexar Anti-reflets Autres Sans anti-reflets,"Pexar offre l'antiriflesso, gli altri no",,,,,,,,
,,,"Place it Anywhere, Display Even without WiFi ","Überall platzierbar, Anzeige auch ohne WLAN",Colócalo en cualquier lugar y disfrútalo incluso sin Wi-Fi,"Installez-le où vous voulez, l'affichage fonctionne même sans Wi-Fi","Posizionala ovunque, funziona anche senza Wi-Fi",,,,,,,,
,,,"Portrait Orientation, Landscape Orientation ","Hochformat, Querformat",Orientación de retrato o apaisada,"Orientation portrait, Orientation paysage","Orientamento verticale, orientamento orizzontale",,,,,,,,
,,,"Share Moments Anytime, Anywhere",Momente jederzeit und überall teilen,Comparte tus momentos en cualquier momento y lugar,"Partagez vos souvenirs à tout moment, où que vous soyez","Condividi i tuoi ricordi in qualsiasi momento, ovunque",,,,,,,,
,,,"64GB Local Storage, Private and Secure","64 GB lokaler Speicher, privat und sicher","64 GB de almacenamiento local, privado y seguro","Stockage local de 64 Go, Privé et sécurisé","64 GB di memoria interna, privata e sicura",,,,,,,,
,,,Expand Storage,Speicher erweitern,Almacenamiento ampliable,Possibilité d'étendre le stockage,Espandi la memoria,,,,,,,,
,,,SD Card,SD-Karte,Tarjeta SD,Carte SD,Scheda SD,,,,,,,,
,,,USB Drive,USB-Laufwerk,Unidad USB,Lecteur USB,Unità USB,,,,,,,,
,,,100% Privacy Protection,100 % Schutz der Privatsphäre,Protección total de la privacidad,Protection totale de la vie privée,Protezione della privacy al 100%,,,,,,,,
,,,"GDPR Compliant, CCPA Compliant, PSTI Compliant","DSGVO-konform, CCPA-konform, PSTI-konform","Cumple el GDPR, la CCPA y la PSTI","Conforme au RGPD, à la CCPA et à la PSTI","Conformità al GDPR, al CCPA e al PSTI",,,,,,,,
,,,Surprise Loved Ones with Greeting Mode,Überraschen Sie mit dem Grußmodus,Sorprende a tus seres queridos con el modo de bienvenida,Surprenez vos proches avec le mode message d'accueil,Sorprendi i tuoi cari con la modalità di messaggio di benvenuto,,,,,,,,
,,,Easily Organize and Display Albums ,Alben einfach organisieren und anzeigen,Organiza y expón álbumes fácilmente,Organisez et affichez facilement vos albums,Consente di organizzare e visualizzare facilmente gli album,,,,,,,,
,,,Select album to play,Album zum Abspielen auswählen,Selecciona el álbum que quieras reproducir,Sélectionner l'album à lire,Selezionare l'album da riprodurre,,,,,,,,
,,,with my dog,mit meinem Hund,con mi perro,Avec mon chien,con il mio cane,,,,,,,,
,,,Oh my baby,Oh mein Baby,Mi bebé,Mon bébé,il mio bambino,,,,,,,,
,,,with him,mit ihm,Con él,Avec lui,con lui,,,,,,,,
,,,my holiday,mein Urlaub,Mis vacaciones,Mes vacances,la mia vacanza,,,,,,,,
,,,my weekend,mein Wochenende,Mi finde,Mon week-end,il mio fine settimana,,,,,,,,
,,,Playing in slideshow,Als Diashow abspielen,Reproducción de diapositivas,Lecture dans le diaporama,Riproduzione in modalità presentazione,,,,,,,,
,店铺,,Digital Picture Frame,Digitaler Bilderrahmen,Marco fotográfico digital,Cadre photo numérique,Cornice digitale,,,,,,,,
,,,"Memory, Now in Stunning 2K","Ihre Erinnerungen, jetzt in beeindruckendem 2K","Tus recuerdos, ahora en impresionante 2K","Vos souvenirs, désormais disponibles en 2K","I tuoi ricordi, ora in straordinaria risoluzione 2K",,,,,,,,
,,,Gift for Family,Geschenk für die Familie,Regalo para toda la familia,Un cadeau pour toute la famille,Regalo per la famiglia,,,,,,,,
,,,Gift for Moms,Geschenk für Mütter,Regalo para mamás,Un cadeau pour les mamans,Regalo per le mamme,,,,,,,,
,,,Gift for Grandparents,Geschenk für Großeltern,Regalo para abuelos,Un cadeau pour les grands-parents,Regalo per i nonni,,,,,,,,
,,,Gift for Dads,Geschenk für Väter,Regalo para padres,Un cadeau pour les papas,Regalo per i papà,,,,,,,,
,,,Gift for Couples,Geschenk für Paare,Regalo para parejas,Un cadeau pour les couples,Regalo per le coppie,,,,,,,,
,,,Gift for Housewarming,Geschenk zum Einzug,Regalo para inauguración de una vivienda,Un cadeau pour une pendaison de crémaillère,Regalo per una nuova casa,,,,,,,,
,,,Why They Love pexar,Warum Pexar so beliebt ist,Por qué les encanta Pexar,Pourquoi ils aiment pexar,Perché amano Pexar,,,,,,,,
,,,The best 2K digital picture frame,Der beste digitale 2K-Bilderrahmen,El mejor marco de fotos digital 2K,Le meilleur cadre photo numérique 2K,La migliore cornice digitale con risoluzione 2K,,,,,,,,
,,,Anti-glare extordinary clarity,Unglaublich klare Bilder ohne Spiegeln,Extraordinaria claridad antirreflejos,Clarté exceptionnelle grâce à l'écran anti-reflets,Antiriflesso per una chiarezza straordinaria,,,,,,,,
,,,Invite others to share from anywhere,Teilen Sie Bilder mit anderen,Invita a otros usuarios a compartir desde cualquier lugar,Invitez vos proches à partager leurs médias depuis n'importe où,Invita altre persone a condividere da qualsiasi luogo,,,,,,,,
,,,Worry-free private local storage,Privater lokaler Speicher ohne Bedenken,Almacenamiento local privado sin preocupaciones,Stockage local privé et sécurisé,Memoria interna privata per la massima tranquillità,,,,,,,,
,,,Top Media Comments,Medienecho,Comentarios de los medios especializados,Ce que les médias en disent,I migliori commenti dei media,,,,,,,,
,,,"""pexar Frame: bright, brilliant, make your photos glow for less dough.""","„Pexar Rahmen: hell, brillant, bringt für wenig Geld Ihre Fotos zum Strahlen.""","«Marco Pexar: luminoso y brillante, haz que tus fotos brillen por menos.»",« Le cadre pexar : des images éclatantes pour un prix tout doux. »,"""Cornice pexar: luminosa e brillante, fa risplendere le tue foto senza spendere una fortuna"".",,,,,,,,
,,,"""It looks good in pictures, looks even better in the hands of the people you care about.""","„Schön auf Bildern, noch schöner in den Händen Ihrer Liebsten.""","«Se ve genial en las fotos, y aún mejor en las manos de tus seres queridos.»","« Le cadre est beau en photo, mais encore plus dans les mains de ceux que vous aimez. »","""Fantastica in foto, ancora meglio nelle mani delle persone che ami.""",,,,,,,,
,,,"""pexar... did a great job of displaying our test images.""","„Pexar … hat unsere Testbilder hervorragend angezeigt.""",«Pexar ha hecho un gran trabajo mostrando nuestras imágenes de prueba.»,« pexar… a parfaitement affiché nos images de test. »,"""Pexar... ha fatto un ottimo lavoro nel permetterci di visualizzare le nostre immagini di prova.""",,,,,,,,
,,,”A top-quality digital photo frame with 2K resolution.”,"„Ein hochqualitativer digitaler Fotorahmen mit 2K-Auflösung.""",«Marco de fotos digital de alta calidad con resolución 2K.»,« Un cadre photo numérique de haute qualité avec une résolution 2K. »,"""Un quadro digitale di alta qualità con risoluzione 2K.""",,,,,,,,
,,,World's First Wall-Light Frame,Der erste beleuchtete Wandbilderrahmen,El primer marco de pared con luz del mundo,Le premier cadre mural lumineux au monde,La prima cornice da parete luminosa al mondo,,,,,,,,
,,,"15.6"" pexar starlight digital picture frame","15,6"" Pexar Starlight digitaler Bilderrahmen","Marco fotográfico digital de 15,6"" Pexar Starlight","Cadre photo numérique pexar Starlight 39,6 cm","Cornice digitale Pexar Starlight da 15,6 pollici",,,,,,,,
,,,Yanko Design Editors Choice,Yanko Design: Editors Choice,Elección del editor de Yanko Design,Choix des rédacteurs de Yanko Design,La scelta dell'editore Yanko Design,,,,,,,,
,,,11'' Digital Picture Frame - Black,11'' Digitaler Bilderrahmen – Schwarz,Marco fotográfico digital de 11'' - Negro,"Cadre photo numérique 11"" - Noir",Cornice digitale per immagini da 11 pollici - Nero,,,,,,,,
,,,11'' Digital Picture Frame - Sand,11'' Digitaler Bilderrahmen – Sand,Marco fotográfico digital de 11'' - Arena,"Cadre photo numérique 11"" - Sable",Cornice digitale per immagini da 11 pollici - Sabbia,,,,,,,,
,,,2K anti-glare display,Entspiegeltes 2K-Display,Pantalla 2K antirreflejos,Écran 2K anti-reflets,Display antiriflesso 2K,,,,,,,,
,,,"Reduce reflection, enjoy stunning 2000 x 1200 crisp photos in all lighting conditions.",Weniger Spiegelung – erleben Sie atemberaubende Bilder mit 2000 x 1200 Px in allen Lichtverhältnissen.,Reduce los reflejos y disfruta de fotos nítidas de 2000 x 1200 bajo cualquier iluminación.,"Réduisez les reflets et profitez de superbes photos en 2000 x 1200, quelle que soit la luminosité.","Grazie al riflesso ridotti, puoi ammirare foto nitide 2000 x 1200 in tutte le condizioni di illuminazione.",,,,,,,,
,,,Share from anywhere,Von überall aus teilen,Comparte desde cualquier lugar,Partage depuis n'importe où,Condividi ovunque,,,,,,,,
,,,Friends and family can send photos and videos directly to the frame from anywhere in the world.,Freunde und Verwandte auf der ganzen Welt können Fotos und Videos direkt an den Rahmen schicken.,Tus amigos y familiares pueden enviar fotos y vídeos directamente al marco desde cualquier parte del mundo.,"Vos amis et votre famille peuvent envoyer des photos et vidéos directement au cadre, depuis n'importe quel endroit dans le monde.",Amici e familiari possono inviare foto e video direttamente sulla cornice da qualsiasi parte del mondo.,,,,,,,,
,,,Private and secure local storage,Privater und sicherer lokaler Speicher,Almacenamiento local privado y seguro,Stockage local privé et sécurisé,Archiviazione locale privata e sicura,,,,,,,,
,,,"32GB internal storage, stores over 40,000 600KB photos, expandable with SD card or USB flash drive.","32 GB interner Speicher für über 40.000 Fotos mit je 600 KB, erweiterbar per SD-Karte oder USB Flash-Laufwerk","32 GB de almacenamiento interno; almacena más de 40 000 fotos de 600 KB, ampliable con una tarjeta SD o una unidad flash USB.","Mémoire interne de 32 Go, capable de stocker plus de 40 000 photos de 600 Ko chacune, extensible avec une carte SD ou une clé USB.","32 GB di memoria interna, per memorizzare oltre 40.000 foto da 600 KB, ampliabile con scheda SD o unità flash USB.",,,,,,,,
,,,,Umfassende Datensicherheit,Protección de datos mejorada,Renforcement de la protection des données,Rafforza la protezione dei dati,,,,,,,,
